{
  "id": "a1b2c3d4-e5f6-7890-abcd-ef1234567890",
  "username": "jsmith",
  "email": "jsmith@example.com",
  "name": "John Smith",
  "created_at": "2024-01-10T09:00:00Z",
  "updated_at": "2025-05-20T14:00:00Z",
  "last_seen_at": "2025-06-12T08:00:00Z",
  "status": "active",
  "login_type": "github",
  "avatar_url": "https://avatars.githubusercontent.com/u/12345?v=4",
  "organization_ids": [
    "b2c3d4e5-f6a7-8901-bcde-f12345678901"
  ],
  "roles": [
    {
      "name": "member",
      "display_name": "Member",
      "organization_id": ""
    }
  ],
  "theme_preference": ""
}